{
  "schema_version": "1",
  "series_id": "s_p_0001.reading",
  "run_id": "run_0042",
  "kind": "sensor",
  "element": "s_p_0001",
  "quantity": "pressure",
  "unit": "m",
  "label": "SENSOR_SIM",
  "start": "2027-03-04T22:00:00Z",
  "step_seconds": 300,
  "values": [
    31.42,
    31.4,
    null,
    31.37
  ]
}
